{
  "version": 0,
  "architecture": "x86_64",
  "execution_point": {
    "source_file": "kernel/arch/x86_64/boot.asm",
    "entry_symbol": "_start",
    "required_after_marker": "KOZO_MEMORY_INIT_OK",
    "required_before_symbol": "runtime_progression_entry"
  },
  "required_cpu_features": {
    "maximum_basic_leaf_query": 0,
    "required_leaf": 1,
    "leaf_1_register": "edx",
    "required_bits": [
      {"name": "FPU", "bit": 0},
      {"name": "FXSR", "bit": 24},
      {"name": "SSE", "bit": 25},
      {"name": "SSE2", "bit": 26}
    ],
    "required_mask": "0x07000001"
  },
  "cr0_policy": {
    "read_modify_write": true,
    "readback_required": true,
    "required_set_bits": [
      {"name": "MP", "bit": 1},
      {"name": "NE", "bit": 5}
    ],
    "required_clear_bits": [
      {"name": "EM", "bit": 2},
      {"name": "TS", "bit": 3}
    ]
  },
  "cr4_policy": {
    "read_modify_write": true,
    "readback_required": true,
    "required_set_bits": [
      {"name": "OSFXSR", "bit": 9},
      {"name": "OSXMMEXCPT", "bit": 10}
    ],
    "required_clear_bits": [
      {"name": "OSXSAVE", "bit": 18}
    ]
  },
  "x87_initialization": {
    "operation": "fninit",
    "observation_operation": "fnstcw",
    "observation_symbol": "observed_x87_control_word",
    "expected_control_word": "0x037f"
  },
  "sse_initialization": {
    "load_operation": "ldmxcsr",
    "observation_operation": "stmxcsr",
    "observation_symbol": "observed_mxcsr",
    "expected_mxcsr": "0x00001f80"
  },
  "simd_probe": {
    "entry_symbol": "run_simd_survival_probe",
    "operation": "pxor",
    "width_bytes": 16,
    "buffer_symbol": "simd_probe_result",
    "buffer_end_symbol": "simd_probe_result_end",
    "buffer_size_bytes": 16,
    "buffer_alignment_bytes": 16,
    "input_low": "0x0011223344556677",
    "input_high": "0x8899aabbccddeeff",
    "mask_low": "0xffff0000ffff0000",
    "mask_high": "0x0f0f0f0f0f0f0f0f",
    "expected_low": "0xffee2233bbaa6677",
    "expected_high": "0x8796a5b4c3d2e1f0",
    "scalar_result_validation": true,
    "output_restored_to_zero": true,
    "xmm_register_cleared": true
  },
  "success_markers": [
    "KOZO_CPU_EXT_STATE_INIT_START",
    "KOZO_CPU_EXT_STATE_INIT_OK",
    "KOZO_SIMD_PROBE_OK"
  ],
  "failure_statuses": {
    "success": 0,
    "cpuid_unavailable": 1,
    "required_feature_missing": 2,
    "control_configuration_failed": 3,
    "x87_initialization_failed": 4,
    "sse_initialization_failed": 5,
    "simd_probe_failed": 6
  },
  "runtime_continuation": {
    "initialization_symbol": "initialize_cpu_extended_state",
    "runtime_entry_symbol": "runtime_progression_entry",
    "runtime_entry_requires_simd_marker": true,
    "failure_terminal_behavior": "cli_hlt_loop",
    "halt_label": ".halt"
  },
  "avx_prohibition": {
    "cr4_osxsave_required_value": 0,
    "xsetbv_allowed": false,
    "xgetbv_required": false,
    "forbidden_register_classes": ["ymm", "zmm"],
    "forbidden_encoding_classes": ["VEX", "EVEX"],
    "forbidden_instruction_families": ["AVX", "AVX2", "AVX-512"]
  },
  "claim_boundary": {
    "proves": [
      "required boot CPU x87 and SSE feature bits were detected",
      "required CR0 and CR4 controls were configured and read back",
      "x87 control state and MXCSR were initialized and observed",
      "one bounded SSE2 operation produced the expected result before Odin entry"
    ],
    "does_not_prove": [
      "AVX support",
      "XSAVE support",
      "per-task extended-state ownership",
      "extended-state context switching",
      "floating-point exception recovery",
      "general CPU initialization completeness",
      "production readiness"
    ]
  },
  "non_goals": [
    "AVX",
    "AVX2",
    "AVX-512",
    "OSXSAVE enablement",
    "XCR0 configuration",
    "XSAVE and XRSTOR",
    "extended-state context switching",
    "scheduler behavior",
    "interrupt handling",
    "exception recovery",
    "userspace execution",
    "hardware syscall entry",
    "allocator behavior",
    "Linux compatibility",
    "POSIX compatibility",
    "production readiness"
  ]
}
